url,status,final_url,redirects,title,description,canonical,robots,hreflang,main_content_words,internal_links,schema
https://pricingnest.com/glossary/usage-based-pricing/,200,https://pricingnest.com/glossary/usage-based-pricing/,0,Usage-Based Pricing | PricingNest,Charging based on consumption (calls  events  GB  minutes) instead of seats alone.,https://pricingnest.com/glossary/usage-based-pricing/,index,follow,,304,23,none
https://pricingnest.com/glossary/usage-cap/,200,https://pricingnest.com/glossary/usage-cap/,0,Usage Cap | PricingNest,A maximum usage limit; prevents extreme bills and protects margins.,https://pricingnest.com/glossary/usage-cap/,index,follow,,213,19,none
https://pricingnest.com/glossary/usage-forecast/,200,https://pricingnest.com/glossary/usage-forecast/,0,Usage Forecast | PricingNest,Projected customer usage over time; used to design tiers and commitments.,https://pricingnest.com/glossary/usage-forecast/,index,follow,,224,19,none
https://pricingnest.com/glossary/value-metric/,200,https://pricingnest.com/glossary/value-metric/,0,Value Metric | PricingNest,The metric that best correlates with value delivered (seat  call  GB  etc.).,https://pricingnest.com/glossary/value-metric/,index,follow,,233,19,none
https://pricingnest.com/glossary/variable-cost/,200,https://pricingnest.com/glossary/variable-cost/,0,Variable Cost | PricingNest,Cost that scales with usage (calls  GB  minutes); drives unit economics and margin.,https://pricingnest.com/glossary/variable-cost/,index,follow,,229,19,none
https://pricingnest.com/guides/,200,https://pricingnest.com/guides/,0,Guides | PricingNest,Practical guides for SaaS pricing decisions  unit economics  and cloud cost recovery.,https://pricingnest.com/guides/,index,follow,,600,40,none
https://pricingnest.com/guides/annual-discount-mistakes/,200,https://pricingnest.com/guides/annual-discount-mistakes/,0,Annual Discount Mistakes (How Teams Over-Discount) | PricingNest,Common mistakes with annual discounts and how to sanity-check them with effective rate and churn thinking.,https://pricingnest.com/guides/annual-discount-mistakes/,index,follow,,270,22,none
https://pricingnest.com/guides/annual-prepay-discount/,200,https://pricingnest.com/guides/annual-prepay-discount/,0,Annual Prepay Discount (Break-Even Guide) | PricingNest,How to choose an annual discount with churn and cash-flow in mind.,https://pricingnest.com/guides/annual-prepay-discount/,index,follow,,264,23,none
https://pricingnest.com/guides/api-cost-estimation/,200,https://pricingnest.com/guides/api-cost-estimation/,0,API Cost Estimation (Cost per Call) | PricingNest,How to estimate cost per request  include vendor costs  and avoid margin surprises.,https://pricingnest.com/guides/api-cost-estimation/,index,follow,,269,22,none
https://pricingnest.com/guides/api-pricing-model/,200,https://pricingnest.com/guides/api-pricing-model/,0,API Pricing Model (How to Price per 1k Calls) | PricingNest,A step-by-step model for costs  margins  and tier design for API products.,https://pricingnest.com/guides/api-pricing-model/,index,follow,,275,23,none
https://pricingnest.com/guides/api-tier-design/,200,https://pricingnest.com/guides/api-tier-design/,0,API Tier Design (Breakpoints  Overages  Included Calls) | PricingNest,How to pick tier breakpoints and included usage so bills stay predictable while margins hold.,https://pricingnest.com/guides/api-tier-design/,index,follow,,262,22,none
https://pricingnest.com/guides/bandwidth-pricing-guide/,200,https://pricingnest.com/guides/bandwidth-pricing-guide/,0,Bandwidth Pricing Guide (Egress Cost Recovery) | PricingNest,How to price bandwidth/egress features using blended costs  tiers  and gross margin targets.,https://pricingnest.com/guides/bandwidth-pricing-guide/,index,follow,,281,22,none
https://pricingnest.com/guides/cac-payback-targets/,200,https://pricingnest.com/guides/cac-payback-targets/,0,CAC Payback Targets (How Many Months Is Healthy?) | PricingNest,How to think about CAC payback targets by channel and growth stage  with trade-offs.,https://pricingnest.com/guides/cac-payback-targets/,index,follow,,247,22,none
https://pricingnest.com/guides/free-tier-modeling/,200,https://pricingnest.com/guides/free-tier-modeling/,0,Free Tier Modeling (When It Works  When It Burns You) | PricingNest,How to model free tiers  included usage  and abuse risk using simple cost and margin checks.,https://pricingnest.com/guides/free-tier-modeling/,index,follow,,275,22,none
https://pricingnest.com/guides/gross-margin-vs-contribution-margin/,200,https://pricingnest.com/guides/gross-margin-vs-contribution-margin/,0,Gross Margin vs Contribution Margin (Which to Use for Pricing) | PricingNest,When to use gross margin vs contribution margin in pricing and CAC payback models.,https://pricingnest.com/guides/gross-margin-vs-contribution-margin/,index,follow,,260,23,none
https://pricingnest.com/guides/ltv-cac-benchmarks/,200,https://pricingnest.com/guides/ltv-cac-benchmarks/,0,LTV:CAC Benchmarks (How to Interpret the Ratio) | PricingNest,How to interpret LTV:CAC  why it breaks  and what to adjust in your assumptions.,https://pricingnest.com/guides/ltv-cac-benchmarks/,index,follow,,258,24,none
https://pricingnest.com/guides/mrr-to-arr-and-back/,200,https://pricingnest.com/guides/mrr-to-arr-and-back/,0,MRR to ARR (And Back): How to Avoid Confusion | PricingNest,How to use MRR/ARR correctly when you have annual plans  usage overages  and discounts.,https://pricingnest.com/guides/mrr-to-arr-and-back/,index,follow,,257,23,none
https://pricingnest.com/guides/price-per-gb-month-explained/,200,https://pricingnest.com/guides/price-per-gb-month-explained/,0,Price per GB-Month (What It Means + Examples) | PricingNest,How GB-month pricing works  how to explain it on a pricing page  and example workloads.,https://pricingnest.com/guides/price-per-gb-month-explained/,index,follow,,281,22,none
https://pricingnest.com/guides/pricing-experiments-playbook/,200,https://pricingnest.com/guides/pricing-experiments-playbook/,0,Pricing Experiments Playbook | PricingNest,How to run price increases and annual prepay tests with clear metrics and guardrails.,https://pricingnest.com/guides/pricing-experiments-playbook/,index,follow,,278,24,none
https://pricingnest.com/guides/pricing-increase-playbook/,200,https://pricingnest.com/guides/pricing-increase-playbook/,0,Price Increase Playbook (Break-Even + Communication) | PricingNest,How to model a price increase  estimate break-even churn  and roll it out safely.,https://pricingnest.com/guides/pricing-increase-playbook/,index,follow,,322,21,none
https://pricingnest.com/guides/pricing-page-unit-definition/,200,https://pricingnest.com/guides/pricing-page-unit-definition/,0,Pricing Page Unit Definitions (Make Units Buyer-Friendly) | PricingNest,How to define units like requests  events  and GB-month so buyers can estimate costs confidently.,https://pricingnest.com/guides/pricing-page-unit-definition/,index,follow,,289,22,none
https://pricingnest.com/guides/saas-gross-margin-targets/,200,https://pricingnest.com/guides/saas-gross-margin-targets/,0,SaaS Gross Margin Targets (How to Choose a Range) | PricingNest,A practical way to pick a gross margin target and avoid common modeling mistakes.,https://pricingnest.com/guides/saas-gross-margin-targets/,index,follow,,267,26,none
https://pricingnest.com/guides/saas-metrics-cheat-sheet/,200,https://pricingnest.com/guides/saas-metrics-cheat-sheet/,0,SaaS Metrics Cheat Sheet (MRR  ARR  LTV  CAC) | PricingNest,Definitions  formulas  and what to watch when you model pricing changes.,https://pricingnest.com/guides/saas-metrics-cheat-sheet/,index,follow,,257,28,none
https://pricingnest.com/guides/seat-vs-usage-pricing/,200,https://pricingnest.com/guides/seat-vs-usage-pricing/,0,Seat vs Usage Pricing (Decision Framework) | PricingNest,A decision framework for choosing seat-based or usage-based pricing  including minimums  tiers  and guardrails.,https://pricingnest.com/guides/seat-vs-usage-pricing/,index,follow,,270,22,none
https://pricingnest.com/guides/storage-costs-and-pricing/,200,https://pricingnest.com/guides/storage-costs-and-pricing/,0,Storage Costs &amp; Pricing (Cost per GB-Month) | PricingNest,How to model storage costs  request costs  and a margin-safe price.,https://pricingnest.com/guides/storage-costs-and-pricing/,index,follow,,254,22,none
https://pricingnest.com/guides/storage-request-costs/,200,https://pricingnest.com/guides/storage-request-costs/,0,Storage Request Costs (When Requests Matter) | PricingNest,When request pricing is material  how to model it  and how to reflect it in pricing.,https://pricingnest.com/guides/storage-request-costs/,index,follow,,371,21,none
https://pricingnest.com/guides/tiered-usage-pricing/,200,https://pricingnest.com/guides/tiered-usage-pricing/,0,Tiered Usage Pricing (Tiers  Overages  Minimums) | PricingNest,How to design tiers that reduce bill shock while protecting margins at p90 usage.,https://pricingnest.com/guides/tiered-usage-pricing/,index,follow,,275,20,none
https://pricingnest.com/guides/unit-economics-model-template/,200,https://pricingnest.com/guides/unit-economics-model-template/,0,Unit Economics Model Template (What to Include) | PricingNest,A checklist for building a lightweight unit economics model you can keep accurate as costs change.,https://pricingnest.com/guides/unit-economics-model-template/,index,follow,,260,25,none
https://pricingnest.com/guides/usage-based-pricing-bill-shock/,200,https://pricingnest.com/guides/usage-based-pricing-bill-shock/,0,Avoiding Bill Shock in Usage-Based Pricing | PricingNest,Guardrails that reduce churn and support load: minimums  tiers  caps  alerts  and examples.,https://pricingnest.com/guides/usage-based-pricing-bill-shock/,index,follow,,282,21,none
https://pricingnest.com/guides/usage-based-pricing-examples/,200,https://pricingnest.com/guides/usage-based-pricing-examples/,0,Usage-Based Pricing Examples (Units  Tiers  Minimums) | PricingNest,Concrete examples you can adapt to calls  events  GB  minutes  and messages.,https://pricingnest.com/guides/usage-based-pricing-examples/,index,follow,,262,23,none
https://pricingnest.com/privacy-policy/,200,https://pricingnest.com/privacy-policy/,0,Privacy Policy | SaaS Pricing Toolkit,Privacy policy for this website and its analytics/ads integrations.,https://pricingnest.com/privacy-policy/,index,follow,,233,16,none
https://pricingnest.com/saas-pricing/,200,https://pricingnest.com/saas-pricing/,0,PricingNest - SaaS Pricing Toolkit (Cost  Margin  Unit Economics),SaaS pricing and cost calculators: usage-based pricing  API pricing  bandwidth and storage cost  and plan comparisons.,https://pricingnest.com/saas-pricing/,index,follow,,658,36,valid
https://pricingnest.com/saas-pricing/annual-discount-calculator/,200,https://pricingnest.com/saas-pricing/annual-discount-calculator/,0,Annual Discount Calculator | PricingNest,Convert a monthly price to an annual prepay price with a discount and compute the effective monthly rate and savings.,https://pricingnest.com/saas-pricing/annual-discount-calculator/,index,follow,,832,23,valid
https://pricingnest.com/saas-pricing/api-cost-estimator/,200,https://pricingnest.com/saas-pricing/api-cost-estimator/,0,API Cost Estimator | PricingNest,Estimate monthly API costs and cost per call from request volume  infra cost per 1k calls  vendor cost per 1k  and fixed overhead.,https://pricingnest.com/saas-pricing/api-cost-estimator/,index,follow,,969,21,valid
https://pricingnest.com/saas-pricing/api-pricing-calculator/,200,https://pricingnest.com/saas-pricing/api-pricing-calculator/,0,API Pricing Calculator | PricingNest,Estimate a monthly API plan price from calls  infra cost per 1k calls  fixed overhead  and a target gross margin.,https://pricingnest.com/saas-pricing/api-pricing-calculator/,index,follow,,1003,26,valid
https://pricingnest.com/saas-pricing/arr-calculator/,200,https://pricingnest.com/saas-pricing/arr-calculator/,0,ARR Calculator | PricingNest,Convert MRR to ARR (Annual Recurring Revenue) and use it as a run-rate metric for SaaS growth reporting.,https://pricingnest.com/saas-pricing/arr-calculator/,index,follow,,749,21,valid
https://pricingnest.com/saas-pricing/bandwidth-cost-calculator/,200,https://pricingnest.com/saas-pricing/bandwidth-cost-calculator/,0,Bandwidth Cost Calculator | PricingNest,Estimate egress/bandwidth cost and a recommended price using your own per-GB costs  fixed overhead  and target gross margin.,https://pricingnest.com/saas-pricing/bandwidth-cost-calculator/,index,follow,,919,22,valid
https://pricingnest.com/saas-pricing/break-even-cac-calculator/,200,https://pricingnest.com/saas-pricing/break-even-cac-calculator/,0,Break-Even CAC Calculator | PricingNest,Estimate the maximum CAC you can afford given ARPA  gross margin  churn  and a target payback period.,https://pricingnest.com/saas-pricing/break-even-cac-calculator/,index,follow,,886,21,valid
https://pricingnest.com/saas-pricing/cac-payback-period-calculator/,200,https://pricingnest.com/saas-pricing/cac-payback-period-calculator/,0,CAC Payback Period Calculator | PricingNest,Estimate how many months it takes to recover CAC using ARPA and gross margin.,https://pricingnest.com/saas-pricing/cac-payback-period-calculator/,index,follow,,856,21,valid
https://pricingnest.com/saas-pricing/churn-impact-calculator/,200,https://pricingnest.com/saas-pricing/churn-impact-calculator/,0,Churn Impact Calculator | PricingNest,Estimate churned revenue over a month and a year from your MRR and monthly churn rate.,https://pricingnest.com/saas-pricing/churn-impact-calculator/,index,follow,,837,23,valid
https://pricingnest.com/saas-pricing/compute-cost-estimator/,200,https://pricingnest.com/saas-pricing/compute-cost-estimator/,0,Compute Cost Estimator | PricingNest,Estimate monthly compute cost from vCPU-hours and GB-hours  then back into a recommended price at your target gross margin.,https://pricingnest.com/saas-pricing/compute-cost-estimator/,index,follow,,959,21,valid
https://pricingnest.com/saas-pricing/ltv-calculator/,200,https://pricingnest.com/saas-pricing/ltv-calculator/,0,LTV Calculator (SaaS) | PricingNest,Estimate customer LTV from ARPA  gross margin  and monthly churn rate.,https://pricingnest.com/saas-pricing/ltv-calculator/,index,follow,,857,21,valid
https://pricingnest.com/saas-pricing/monthly-cloud-cost-estimator/,200,https://pricingnest.com/saas-pricing/monthly-cloud-cost-estimator/,0,Monthly Cloud Cost Estimator | PricingNest,Add up monthly compute  storage  bandwidth  and other costs into a single monthly cloud cost estimate (input-driven).,https://pricingnest.com/saas-pricing/monthly-cloud-cost-estimator/,index,follow,,907,21,valid
https://pricingnest.com/saas-pricing/mrr-calculator/,200,https://pricingnest.com/saas-pricing/mrr-calculator/,0,MRR Calculator | PricingNest,Calculate ending MRR from new  expansion  contraction  and churned MRR.,https://pricingnest.com/saas-pricing/mrr-calculator/,index,follow,,845,22,valid
https://pricingnest.com/saas-pricing/price-per-gb-month-calculator/,200,https://pricingnest.com/saas-pricing/price-per-gb-month-calculator/,0,Price per GB-Month Calculator | PricingNest,Estimate a margin-safe price per GB-month using storage cost per GB-month  fixed overhead  average stored GB  and a target gross margin.,https://pricingnest.com/saas-pricing/price-per-gb-month-calculator/,index,follow,,920,21,valid
https://pricingnest.com/saas-pricing/pricing-increase-impact-calculator/,200,https://pricingnest.com/saas-pricing/pricing-increase-impact-calculator/,0,Pricing Increase Impact Calculator | PricingNest,Estimate the impact of a price increase on monthly revenue  including an assumption for customer churn from the increase.,https://pricingnest.com/saas-pricing/pricing-increase-impact-calculator/,index,follow,,875,23,valid
https://pricingnest.com/saas-pricing/seat-vs-usage-pricing-comparison/,200,https://pricingnest.com/saas-pricing/seat-vs-usage-pricing-comparison/,0,Seat vs Usage Pricing Comparison | PricingNest,Compare a seat-based plan against usage-based pricing for the same workload  including a clear cost difference.,https://pricingnest.com/saas-pricing/seat-vs-usage-pricing-comparison/,index,follow,,944,23,valid
https://pricingnest.com/saas-pricing/storage-cost-calculator/,200,https://pricingnest.com/saas-pricing/storage-cost-calculator/,0,Storage Cost Calculator | PricingNest,Estimate storage cost from average GB stored  request volume  and per-unit costs  then compute a price at your target margin.,https://pricingnest.com/saas-pricing/storage-cost-calculator/,index,follow,,931,23,valid
https://pricingnest.com/saas-pricing/tiered-usage-pricing-calculator/,200,https://pricingnest.com/saas-pricing/tiered-usage-pricing-calculator/,0,Tiered Usage Pricing Calculator | PricingNest,Estimate a monthly bill for a platform fee + included usage + tiered overages (up to 3 tiers)  plus effective rates.,https://pricingnest.com/saas-pricing/tiered-usage-pricing-calculator/,index,follow,,1055,21,valid
https://pricingnest.com/saas-pricing/usage-based-pricing-calculator/,200,https://pricingnest.com/saas-pricing/usage-based-pricing-calculator/,0,Usage-Based Pricing Calculator | PricingNest,Estimate a per-unit price from unit costs  fixed overhead  and a target gross margin. Generates revenue and gross profit estimates.,https://pricingnest.com/saas-pricing/usage-based-pricing-calculator/,index,follow,,1061,27,valid
https://pricingnest.com/saas-pricing/use-cases/,200,https://pricingnest.com/saas-pricing/use-cases/,0,SaaS Pricing Use Cases | PricingNest,Practical flows for SaaS pricing decisions: usage-based pricing  API pricing  infra cost recovery  unit economics  and pricing experiments.,https://pricingnest.com/saas-pricing/use-cases/,index,follow,,224,22,none
https://pricingnest.com/saas-pricing/use-cases/api-pricing/,200,https://pricingnest.com/saas-pricing/use-cases/api-pricing/,0,API Pricing for SaaS - Use Case | SaaS Pricing Toolkit,A simple flow for pricing an API product: estimate costs  back into target margin  and compare seat vs usage.,https://pricingnest.com/saas-pricing/use-cases/api-pricing/,index,follow,,197,19,none
https://pricingnest.com/saas-pricing/use-cases/infra-cost-recovery/,200,https://pricingnest.com/saas-pricing/use-cases/infra-cost-recovery/,0,Infra Cost Recovery - Use Case | SaaS Pricing Toolkit,A simple flow for pricing infra-heavy features: bandwidth + storage cost estimation  then pricing at target margin.,https://pricingnest.com/saas-pricing/use-cases/infra-cost-recovery/,index,follow,,177,19,none
https://pricingnest.com/saas-pricing/use-cases/pricing-experiments/,200,https://pricingnest.com/saas-pricing/use-cases/pricing-experiments/,0,Pricing Experiments - Use Case | PricingNest,A practical flow for pricing experiments: model price increase impact  estimate break-even churn  and compare annual discount tradeoffs.,https://pricingnest.com/saas-pricing/use-cases/pricing-experiments/,index,follow,,194,20,none
https://pricingnest.com/saas-pricing/use-cases/unit-economics/,200,https://pricingnest.com/saas-pricing/use-cases/unit-economics/,0,SaaS Unit Economics - Use Case | PricingNest,A practical flow for SaaS unit economics: connect churn  LTV  CAC payback  break-even CAC  and ARR run rate.,https://pricingnest.com/saas-pricing/use-cases/unit-economics/,index,follow,,214,22,none
https://pricingnest.com/saas-pricing/use-cases/usage-based-pricing/,200,https://pricingnest.com/saas-pricing/use-cases/usage-based-pricing/,0,Usage-Based Pricing - Use Case | PricingNest,A practical flow for usage-based pricing: estimate unit price from costs and margin  then validate against seat-based alternatives.,https://pricingnest.com/saas-pricing/use-cases/usage-based-pricing/,index,follow,,199,20,none
https://pricingnest.com/terms/,200,https://pricingnest.com/terms/,0,Terms of Use | SaaS Pricing Toolkit,Terms of use and disclaimer for calculator outputs.,https://pricingnest.com/terms/,index,follow,,105,16,none