url,status,final_url,redirects,title,description,canonical,robots,hreflang,main_content_words,internal_links,schema
https://pricingnest.com/,200,https://pricingnest.com/,0,SaaS Pricing Toolkit - High-Intent Calculators,A lightweight set of SaaS pricing and cloud cost tools designed for SEO and tier-1 traffic.,https://pricingnest.com/,index,follow,,293,21,valid
https://pricingnest.com/about/,200,https://pricingnest.com/about/,0,About | PricingNest,What PricingNest is  how the calculators work  and what assumptions to use for SaaS pricing and cloud unit economics.,https://pricingnest.com/about/,index,follow,,258,16,none
https://pricingnest.com/contact/,200,https://pricingnest.com/contact/,0,Contact | SaaS Pricing Toolkit,Contact information and feedback details for this website.,https://pricingnest.com/contact/,index,follow,,174,16,none
https://pricingnest.com/cookie-policy/,200,https://pricingnest.com/cookie-policy/,0,Cookie Policy | SaaS Pricing Toolkit,Cookie policy and consent preferences for this website.,https://pricingnest.com/cookie-policy/,index,follow,,188,16,none
https://pricingnest.com/glossary/,200,https://pricingnest.com/glossary/,0,Glossary | PricingNest,Short definitions for the key SaaS pricing and unit economics terms used in the toolkit.,https://pricingnest.com/glossary/,index,follow,,1378,111,none
https://pricingnest.com/glossary/a-b-test/,200,https://pricingnest.com/glossary/a-b-test/,0,A/B Test | PricingNest,Experiment comparing two variants; used for pricing pages and packaging.,https://pricingnest.com/glossary/a-b-test/,index,follow,,252,17,none
https://pricingnest.com/glossary/activation/,200,https://pricingnest.com/glossary/activation/,0,Activation | PricingNest,The moment a user experiences core value; the hinge point between signup and habit.,https://pricingnest.com/glossary/activation/,index,follow,,243,20,none
https://pricingnest.com/glossary/acv/,200,https://pricingnest.com/glossary/acv/,0,ACV (Annual Contract Value) | PricingNest,Annualized contract value; often used for sales performance and enterprise pricing.,https://pricingnest.com/glossary/acv/,index,follow,,231,18,none
https://pricingnest.com/glossary/add-on/,200,https://pricingnest.com/glossary/add-on/,0,Add-on | PricingNest,Optional feature or capacity sold separately  often used for expansion revenue.,https://pricingnest.com/glossary/add-on/,index,follow,,243,21,none
https://pricingnest.com/glossary/annual-plan/,200,https://pricingnest.com/glossary/annual-plan/,0,Annual Plan | PricingNest,A plan billed yearly; often includes discounts and changes cash timing.,https://pricingnest.com/glossary/annual-plan/,index,follow,,221,18,none
https://pricingnest.com/glossary/annual-prepay-discount/,200,https://pricingnest.com/glossary/annual-prepay-discount/,0,Annual Prepay Discount | PricingNest,Discount for annual commitment; trades revenue for cash flow and retention.,https://pricingnest.com/glossary/annual-prepay-discount/,index,follow,,275,22,none
https://pricingnest.com/glossary/api-call/,200,https://pricingnest.com/glossary/api-call/,0,API Call | PricingNest,A request to an API endpoint; can be priced per call or per 1 000 calls.,https://pricingnest.com/glossary/api-call/,index,follow,,227,17,none
https://pricingnest.com/glossary/arpa-per-seat/,200,https://pricingnest.com/glossary/arpa-per-seat/,0,Revenue per Seat | PricingNest,Average recurring revenue per seat and how it changes under pricing models.,https://pricingnest.com/glossary/arpa-per-seat/,index,follow,,241,19,none
https://pricingnest.com/glossary/arpa/,200,https://pricingnest.com/glossary/arpa/,0,ARPA / ARPU | PricingNest,Average revenue per account (or user) used in LTV and payback models.,https://pricingnest.com/glossary/arpa/,index,follow,,247,22,none
https://pricingnest.com/glossary/arpu/,200,https://pricingnest.com/glossary/arpu/,0,ARPU | PricingNest,Average revenue per user; used more in consumer apps than B2B accounts.,https://pricingnest.com/glossary/arpu/,index,follow,,230,18,none
https://pricingnest.com/glossary/arr/,200,https://pricingnest.com/glossary/arr/,0,ARR | PricingNest,Annual recurring revenue; MRR x 12 run-rate for subscriptions.,https://pricingnest.com/glossary/arr/,index,follow,,215,20,none
https://pricingnest.com/glossary/arrr/,200,https://pricingnest.com/glossary/arrr/,0,ARRR Funnel | PricingNest,Acquisition  Activation  Retention  Revenue  Referral; a lifecycle view for growth and pricing.,https://pricingnest.com/glossary/arrr/,index,follow,,226,21,none
https://pricingnest.com/glossary/backup/,200,https://pricingnest.com/glossary/backup/,0,Backups | PricingNest,Data copies for recovery; often adds storage overhead and retrieval costs.,https://pricingnest.com/glossary/backup/,index,follow,,221,17,none
https://pricingnest.com/glossary/bandwidth/,200,https://pricingnest.com/glossary/bandwidth/,0,Bandwidth | PricingNest,Data transferred per time  typically priced per GB with tiered rates.,https://pricingnest.com/glossary/bandwidth/,index,follow,,279,22,none
https://pricingnest.com/glossary/bill-shock/,200,https://pricingnest.com/glossary/bill-shock/,0,Bill Shock | PricingNest,Unexpectedly high invoices in usage pricing; reduces retention and trust.,https://pricingnest.com/glossary/bill-shock/,index,follow,,218,19,none
https://pricingnest.com/glossary/billing-cycle/,200,https://pricingnest.com/glossary/billing-cycle/,0,Billing Cycle | PricingNest,How often you invoice (monthly  annual); affects churn measurement and cash flow.,https://pricingnest.com/glossary/billing-cycle/,index,follow,,223,19,none
https://pricingnest.com/glossary/blended-cost/,200,https://pricingnest.com/glossary/blended-cost/,0,Blended Cost | PricingNest,Weighted average unit cost across regions  tiers  and discounts.,https://pricingnest.com/glossary/blended-cost/,index,follow,,229,18,none
https://pricingnest.com/glossary/bookings/,200,https://pricingnest.com/glossary/bookings/,0,Bookings | PricingNest,Contracted revenue (often annual) that may differ from recognized revenue and ARR.,https://pricingnest.com/glossary/bookings/,index,follow,,215,19,none
https://pricingnest.com/glossary/break-even-churn/,200,https://pricingnest.com/glossary/break-even-churn/,0,Break-even Churn | PricingNest,Churn rate where a price increase produces no net revenue gain.,https://pricingnest.com/glossary/break-even-churn/,index,follow,,232,19,none
https://pricingnest.com/glossary/burst-traffic/,200,https://pricingnest.com/glossary/burst-traffic/,0,Burst Traffic | PricingNest,Spiky usage patterns; increases risk in usage-based pricing and capacity planning.,https://pricingnest.com/glossary/burst-traffic/,index,follow,,225,17,none
https://pricingnest.com/glossary/cac-payback/,200,https://pricingnest.com/glossary/cac-payback/,0,CAC Payback Period | PricingNest,How many months of gross profit it takes to recover CAC.,https://pricingnest.com/glossary/cac-payback/,index,follow,,245,21,none
https://pricingnest.com/glossary/cac/,200,https://pricingnest.com/glossary/cac/,0,CAC (Customer Acquisition Cost) | PricingNest,Cost to acquire a customer; use with gross profit to estimate payback.,https://pricingnest.com/glossary/cac/,index,follow,,251,23,none
https://pricingnest.com/glossary/cdn/,200,https://pricingnest.com/glossary/cdn/,0,CDN | PricingNest,Content Delivery Network; reduces origin load but can introduce request fees.,https://pricingnest.com/glossary/cdn/,index,follow,,228,17,none
https://pricingnest.com/glossary/churn-cohort/,200,https://pricingnest.com/glossary/churn-cohort/,0,Churn Cohort | PricingNest,Churn measured by cohort to avoid misleading period-over-period comparisons.,https://pricingnest.com/glossary/churn-cohort/,index,follow,,243,19,none
https://pricingnest.com/glossary/churn-mitigation/,200,https://pricingnest.com/glossary/churn-mitigation/,0,Churn Mitigation | PricingNest,Tactics to reduce churn  from onboarding and guardrails to pricing and packaging.,https://pricingnest.com/glossary/churn-mitigation/,index,follow,,252,22,none
https://pricingnest.com/glossary/churn/,200,https://pricingnest.com/glossary/churn/,0,Churn (Customer &amp; Revenue) | PricingNest,Loss of customers or recurring revenue over time (logo vs revenue churn).,https://pricingnest.com/glossary/churn/,index,follow,,247,23,none
https://pricingnest.com/glossary/cogs/,200,https://pricingnest.com/glossary/cogs/,0,COGS (Cost of Goods Sold) | PricingNest,Direct costs to deliver your product (infra + vendor costs for SaaS).,https://pricingnest.com/glossary/cogs/,index,follow,,265,23,none
https://pricingnest.com/glossary/cohort-retention/,200,https://pricingnest.com/glossary/cohort-retention/,0,Cohort Retention | PricingNest,Retention measured by customer cohorts over time; helps interpret churn correctly.,https://pricingnest.com/glossary/cohort-retention/,index,follow,,228,19,none
https://pricingnest.com/glossary/cohort/,200,https://pricingnest.com/glossary/cohort/,0,Cohort | PricingNest,Group of customers sharing a start date or trait; used to measure retention and churn.,https://pricingnest.com/glossary/cohort/,index,follow,,236,20,none
https://pricingnest.com/glossary/contract-value/,200,https://pricingnest.com/glossary/contract-value/,0,Contract Value | PricingNest,Value of a contract over its term; commonly expressed as TCV or ACV.,https://pricingnest.com/glossary/contract-value/,index,follow,,218,19,none
https://pricingnest.com/glossary/contribution-margin/,200,https://pricingnest.com/glossary/contribution-margin/,0,Contribution Margin | PricingNest,Margin after variable costs (often gross profit minus variable S&#38;M/support).,https://pricingnest.com/glossary/contribution-margin/,index,follow,,233,19,none
https://pricingnest.com/glossary/cross-sell/,200,https://pricingnest.com/glossary/cross-sell/,0,Cross-sell | PricingNest,Selling a different product or add-on to an existing customer; can improve ARPA.,https://pricingnest.com/glossary/cross-sell/,index,follow,,220,19,none
https://pricingnest.com/glossary/discount/,200,https://pricingnest.com/glossary/discount/,0,Discount | PricingNest,Reducing price to drive conversion or commitment; must be modeled for margin impact.,https://pricingnest.com/glossary/discount/,index,follow,,216,18,none
https://pricingnest.com/glossary/downgrade/,200,https://pricingnest.com/glossary/downgrade/,0,Downgrade | PricingNest,Reduction in recurring revenue from a customer due to lower plan or usage.,https://pricingnest.com/glossary/downgrade/,index,follow,,227,19,none
https://pricingnest.com/glossary/effective-monthly-rate/,200,https://pricingnest.com/glossary/effective-monthly-rate/,0,Effective Monthly Rate | PricingNest,Annual price normalized to a monthly equivalent for comparison.,https://pricingnest.com/glossary/effective-monthly-rate/,index,follow,,210,18,none
https://pricingnest.com/glossary/egress/,200,https://pricingnest.com/glossary/egress/,0,Egress | PricingNest,Outbound data transfer; often a significant variable cost for infra products.,https://pricingnest.com/glossary/egress/,index,follow,,243,22,none
https://pricingnest.com/glossary/expansion-revenue/,200,https://pricingnest.com/glossary/expansion-revenue/,0,Expansion Revenue | PricingNest,Revenue gained from existing customers via upsells  usage growth  or add-ons.,https://pricingnest.com/glossary/expansion-revenue/,index,follow,,233,19,none
https://pricingnest.com/glossary/fair-use/,200,https://pricingnest.com/glossary/fair-use/,0,Fair Use | PricingNest,Reasonable usage expectation for plans; prevents abuse and cost spikes.,https://pricingnest.com/glossary/fair-use/,index,follow,,218,18,none
https://pricingnest.com/glossary/feature-gating/,200,https://pricingnest.com/glossary/feature-gating/,0,Feature Gating | PricingNest,Restricting features by plan; shifts value capture beyond pure usage.,https://pricingnest.com/glossary/feature-gating/,index,follow,,252,22,none
https://pricingnest.com/glossary/fixed-cost/,200,https://pricingnest.com/glossary/fixed-cost/,0,Fixed Cost | PricingNest,Costs that do not scale with usage; should be recovered via base fees.,https://pricingnest.com/glossary/fixed-cost/,index,follow,,219,18,none
https://pricingnest.com/glossary/gb-month/,200,https://pricingnest.com/glossary/gb-month/,0,GB-Month | PricingNest,Storage measured as average GB stored over a month (GB times time).,https://pricingnest.com/glossary/gb-month/,index,follow,,248,22,none
https://pricingnest.com/glossary/grace-period/,200,https://pricingnest.com/glossary/grace-period/,0,Grace Period | PricingNest,Time window before enforcing limits after payment failure or overage; impacts churn and support.,https://pricingnest.com/glossary/grace-period/,index,follow,,219,17,none
https://pricingnest.com/glossary/grandfathering/,200,https://pricingnest.com/glossary/grandfathering/,0,Grandfathering | PricingNest,Keeping existing customers on old pricing to reduce churn risk during increases.,https://pricingnest.com/glossary/grandfathering/,index,follow,,226,18,none
https://pricingnest.com/glossary/gross-margin/,200,https://pricingnest.com/glossary/gross-margin/,0,Gross Margin | PricingNest,The percent of revenue left after COGS; a core constraint for pricing.,https://pricingnest.com/glossary/gross-margin/,index,follow,,239,21,none
https://pricingnest.com/glossary/grr/,200,https://pricingnest.com/glossary/grr/,0,GRR (Gross Revenue Retention) | PricingNest,Revenue retention excluding expansions; isolates churn and downgrades.,https://pricingnest.com/glossary/grr/,index,follow,,252,19,none
https://pricingnest.com/glossary/included-usage/,200,https://pricingnest.com/glossary/included-usage/,0,Included Usage | PricingNest,Usage bundled into a plan or platform fee before overages apply.,https://pricingnest.com/glossary/included-usage/,index,follow,,239,18,none
https://pricingnest.com/glossary/logo-churn/,200,https://pricingnest.com/glossary/logo-churn/,0,Logo Churn | PricingNest,Percent of customers who cancel in a period (customer churn).,https://pricingnest.com/glossary/logo-churn/,index,follow,,244,18,none
https://pricingnest.com/glossary/ltv-cac/,200,https://pricingnest.com/glossary/ltv-cac/,0,LTV:CAC | PricingNest,Ratio of lifetime gross profit to CAC; a common unit economics health check.,https://pricingnest.com/glossary/ltv-cac/,index,follow,,229,19,none
https://pricingnest.com/glossary/ltv/,200,https://pricingnest.com/glossary/ltv/,0,LTV (Customer Lifetime Value) | PricingNest,Expected gross profit over a customer,https://pricingnest.com/glossary/ltv/,index,follow,,247,22,none
https://pricingnest.com/glossary/marginal-cost/,200,https://pricingnest.com/glossary/marginal-cost/,0,Marginal Cost | PricingNest,Incremental cost to serve one more unit or customer; key for usage pricing.,https://pricingnest.com/glossary/marginal-cost/,index,follow,,220,19,none
https://pricingnest.com/glossary/minimum-commitment/,200,https://pricingnest.com/glossary/minimum-commitment/,0,Minimum Commitment | PricingNest,A minimum monthly or annual spend requirement  often paired with usage pricing.,https://pricingnest.com/glossary/minimum-commitment/,index,follow,,223,18,none
https://pricingnest.com/glossary/mrr/,200,https://pricingnest.com/glossary/mrr/,0,MRR | PricingNest,Monthly recurring revenue; normalized subscription revenue per month.,https://pricingnest.com/glossary/mrr/,index,follow,,214,20,none
https://pricingnest.com/glossary/net-new-mrr/,200,https://pricingnest.com/glossary/net-new-mrr/,0,Net New MRR | PricingNest,New + expansion MRR minus churn and contraction; core growth metric.,https://pricingnest.com/glossary/net-new-mrr/,index,follow,,217,19,none
https://pricingnest.com/glossary/nrr/,200,https://pricingnest.com/glossary/nrr/,0,NRR (Net Revenue Retention) | PricingNest,Revenue retention including expansions; key for growth and pricing impact.,https://pricingnest.com/glossary/nrr/,index,follow,,237,19,none
https://pricingnest.com/glossary/on-call/,200,https://pricingnest.com/glossary/on-call/,0,On-call | PricingNest,Operational coverage for incidents; a key driver of support cost and SLA pricing.,https://pricingnest.com/glossary/on-call/,index,follow,,253,21,none
https://pricingnest.com/glossary/origin-fetch/,200,https://pricingnest.com/glossary/origin-fetch/,0,Origin Fetch | PricingNest,Traffic from CDN to origin; can affect egress and cost structure.,https://pricingnest.com/glossary/origin-fetch/,index,follow,,220,17,none
https://pricingnest.com/glossary/overage/,200,https://pricingnest.com/glossary/overage/,0,Overage | PricingNest,Charges applied when a customer exceeds included usage or plan limits.,https://pricingnest.com/glossary/overage/,index,follow,,221,19,none
https://pricingnest.com/glossary/p50/,200,https://pricingnest.com/glossary/p50/,0,P50 (Median) Usage | PricingNest,Typical usage level; useful for designing included usage  tiers  and limits.,https://pricingnest.com/glossary/p50/,index,follow,,233,20,none
https://pricingnest.com/glossary/p90/,200,https://pricingnest.com/glossary/p90/,0,P90 Usage | PricingNest,Heavy usage level; use to protect gross margin and avoid subsidizing power users.,https://pricingnest.com/glossary/p90/,index,follow,,233,17,none
https://pricingnest.com/glossary/packaging/,200,https://pricingnest.com/glossary/packaging/,0,Packaging | PricingNest,How you bundle features and limits into plans; shapes value perception and conversion.,https://pricingnest.com/glossary/packaging/,index,follow,,270,22,none
https://pricingnest.com/glossary/payback-period/,200,https://pricingnest.com/glossary/payback-period/,0,Payback Period | PricingNest,Time required to recover CAC from gross profit; key unit economics metric.,https://pricingnest.com/glossary/payback-period/,index,follow,,216,20,none
https://pricingnest.com/glossary/per-active-user/,200,https://pricingnest.com/glossary/per-active-user/,0,Per Active User | PricingNest,Charging based on active users instead of total seats; aligns price with usage intensity.,https://pricingnest.com/glossary/per-active-user/,index,follow,,223,18,none
https://pricingnest.com/glossary/per-seat/,200,https://pricingnest.com/glossary/per-seat/,0,Per Seat | PricingNest,Charging per user seat; simple to explain but can misalign with cost for automation-heavy customers.,https://pricingnest.com/glossary/per-seat/,index,follow,,220,18,none
https://pricingnest.com/glossary/platform-fee/,200,https://pricingnest.com/glossary/platform-fee/,0,Platform Fee | PricingNest,A base fee charged regardless of usage; recovers fixed costs.,https://pricingnest.com/glossary/platform-fee/,index,follow,,213,19,none
https://pricingnest.com/glossary/price-increase/,200,https://pricingnest.com/glossary/price-increase/,0,Price Increase | PricingNest,Raising prices; evaluate break-even churn and rollout strategy.,https://pricingnest.com/glossary/price-increase/,index,follow,,218,19,none
https://pricingnest.com/glossary/pricing-metric/,200,https://pricingnest.com/glossary/pricing-metric/,0,Pricing Metric | PricingNest,The unit you charge on; should be buyer-friendly and align with value/cost.,https://pricingnest.com/glossary/pricing-metric/,index,follow,,225,18,none
https://pricingnest.com/glossary/pricing-page/,200,https://pricingnest.com/glossary/pricing-page/,0,Pricing Page | PricingNest,Your plan and unit definitions; must be clear to avoid sales/support friction.,https://pricingnest.com/glossary/pricing-page/,index,follow,,226,17,none
https://pricingnest.com/glossary/ramp/,200,https://pricingnest.com/glossary/ramp/,0,Ramp | PricingNest,How quickly customers grow into paid usage after signing up; affects payback and tier design.,https://pricingnest.com/glossary/ramp/,index,follow,,220,19,none
https://pricingnest.com/glossary/rate-card/,200,https://pricingnest.com/glossary/rate-card/,0,Rate Card | PricingNest,A list of unit prices for usage  add-ons  and services; useful for enterprise quoting.,https://pricingnest.com/glossary/rate-card/,index,follow,,240,17,none
https://pricingnest.com/glossary/rate-limit/,200,https://pricingnest.com/glossary/rate-limit/,0,Rate Limit | PricingNest,Limits on requests per time window; can protect cost and plan fairness.,https://pricingnest.com/glossary/rate-limit/,index,follow,,226,17,none
https://pricingnest.com/glossary/replication/,200,https://pricingnest.com/glossary/replication/,0,Replication | PricingNest,Storing multiple copies for durability/availability; increases GB-month cost.,https://pricingnest.com/glossary/replication/,index,follow,,220,17,none
https://pricingnest.com/glossary/request-pricing/,200,https://pricingnest.com/glossary/request-pricing/,0,Request Pricing | PricingNest,Pricing based on API or storage requests; requires clear unit definitions.,https://pricingnest.com/glossary/request-pricing/,index,follow,,221,19,none
https://pricingnest.com/glossary/request/,200,https://pricingnest.com/glossary/request/,0,Request | PricingNest,A single operation sent to a service (API request  storage request  etc.).,https://pricingnest.com/glossary/request/,index,follow,,243,17,none
https://pricingnest.com/glossary/retention-curve/,200,https://pricingnest.com/glossary/retention-curve/,0,Retention Curve | PricingNest,Retention plotted over time; highlights early churn vs long-term stickiness.,https://pricingnest.com/glossary/retention-curve/,index,follow,,242,18,none
https://pricingnest.com/glossary/retrieval-fees/,200,https://pricingnest.com/glossary/retrieval-fees/,0,Retrieval Fees | PricingNest,Fees to read data back from cold storage; important for archival products.,https://pricingnest.com/glossary/retrieval-fees/,index,follow,,207,17,none
https://pricingnest.com/glossary/revenue-churn/,200,https://pricingnest.com/glossary/revenue-churn/,0,Revenue Churn | PricingNest,Percent of recurring revenue lost in a period (gross or net).,https://pricingnest.com/glossary/revenue-churn/,index,follow,,240,19,none
https://pricingnest.com/glossary/revenue-recognition/,200,https://pricingnest.com/glossary/revenue-recognition/,0,Revenue Recognition | PricingNest,Accounting treatment of revenue over time; differs from cash collected.,https://pricingnest.com/glossary/revenue-recognition/,index,follow,,228,19,none
https://pricingnest.com/glossary/run-rate/,200,https://pricingnest.com/glossary/run-rate/,0,Run Rate | PricingNest,A normalized revenue pace (e.g.  MRR) used to project annualized performance.,https://pricingnest.com/glossary/run-rate/,index,follow,,231,19,none
https://pricingnest.com/glossary/seat-based-pricing/,200,https://pricingnest.com/glossary/seat-based-pricing/,0,Seat-Based Pricing | PricingNest,Charging by number of users; simple but can break when costs scale with usage.,https://pricingnest.com/glossary/seat-based-pricing/,index,follow,,243,22,none
https://pricingnest.com/glossary/storage-costs/,200,https://pricingnest.com/glossary/storage-costs/,0,Storage Costs | PricingNest,Costs to store data plus requests  replication  backups  and overhead.,https://pricingnest.com/glossary/storage-costs/,index,follow,,258,23,none
https://pricingnest.com/glossary/support-costs/,200,https://pricingnest.com/glossary/support-costs/,0,Support Costs | PricingNest,Support effort that may scale with accounts or usage; influences COGS decisions.,https://pricingnest.com/glossary/support-costs/,index,follow,,257,17,none
https://pricingnest.com/glossary/tcv/,200,https://pricingnest.com/glossary/tcv/,0,TCV (Total Contract Value) | PricingNest,Total value over the full contract term (including multi-year commitments).,https://pricingnest.com/glossary/tcv/,index,follow,,230,18,none
https://pricingnest.com/glossary/throttling/,200,https://pricingnest.com/glossary/throttling/,0,Throttling | PricingNest,Delaying or rejecting requests when usage exceeds limits; impacts user experience.,https://pricingnest.com/glossary/throttling/,index,follow,,209,18,none
https://pricingnest.com/glossary/tiers/,200,https://pricingnest.com/glossary/tiers/,0,Tiers | PricingNest,Pricing levels with different limits or features; used to segment customers.,https://pricingnest.com/glossary/tiers/,index,follow,,203,19,none
https://pricingnest.com/glossary/time-to-value/,200,https://pricingnest.com/glossary/time-to-value/,0,Time to Value | PricingNest,How quickly a customer reaches value; affects churn risk and pricing tolerance.,https://pricingnest.com/glossary/time-to-value/,index,follow,,264,21,none
https://pricingnest.com/glossary/token-pricing/,200,https://pricingnest.com/glossary/token-pricing/,0,Token Pricing | PricingNest,Pricing based on tokens (common for LLM/AI usage); requires careful unit definitions.,https://pricingnest.com/glossary/token-pricing/,index,follow,,256,21,none
https://pricingnest.com/glossary/unit-cost/,200,https://pricingnest.com/glossary/unit-cost/,0,Unit Cost | PricingNest,Cost per unit of usage (call  event  GB  minute) used to set margin-safe prices.,https://pricingnest.com/glossary/unit-cost/,index,follow,,271,23,none
https://pricingnest.com/glossary/unit-economics/,200,https://pricingnest.com/glossary/unit-economics/,0,Unit Economics | PricingNest,Profitability per customer or unit; core input for pricing decisions.,https://pricingnest.com/glossary/unit-economics/,index,follow,,203,20,none
https://pricingnest.com/glossary/unit-test-scenario/,200,https://pricingnest.com/glossary/unit-test-scenario/,0,Scenario Modeling | PricingNest,Best/base/worst cases (p50 vs p90) used to stress-test pricing.,https://pricingnest.com/glossary/unit-test-scenario/,index,follow,,233,19,none
https://pricingnest.com/glossary/upsell/,200,https://pricingnest.com/glossary/upsell/,0,Upsell | PricingNest,Selling a higher plan or add-on to an existing customer; contributes to expansion revenue.,https://pricingnest.com/glossary/upsell/,index,follow,,233,18,none
